9p92bi	MMA Fighter perfectly times opponents spinning attack with a spinning elbow of his own	sports
9pwj8s	Old Teammates Jonas Jerebko and Donovan Mitchell Showing Some Mutual Respect	sports
9u53jb	Miami and Duke played a football game on Slip 'N Slide field conditions	sports
9nu7gd	Water jousting	sports
9kge3w	Amazing throw in Ultimate Frisbee game	sports
9cor8s	Nike’s 30th anniversary of the Just Do It campaign	sports
9lt54f	Kevin Durant, who was drafted by the Seattle SuperSonics before the team relocated, wore a Sonics jersey and was loudly cheered in his return to the city	sports
9h1v1m	Tennis Champion Naomi Osaka's $8.5M Adidas Deal Biggest Ever for a Woman	sports
9ht4c9	One of the most Irish Experiences I’ll ever have: Hurling lessons in a parking lot behind Waterford Crystal, a couple guys preparing for the Regional Championships.	sports
9is5wk	Tiger Woods back on the cover of Sports Illustrated	sports
9ek2ot	This is a soccer/volleyball game called Sepak Takraw native to SE Asia	sports
9f4hnc	Marc Marquez's insane slide(max lean) at US GP	sports
9junth	Dom Sheed kicks the winning goal as West Coast win by 5 points over Collingwood, 79-74, to become AFL premiers	sports
9jkjsa	Head pong	sports
9b1m02	Crazy rally in a 'Spikeball' match, a sport that was featured on Shark Tank and gained popularity.	sports
9s9kra	World Series: Red Sox Beat Dodgers to Win 9th Championship	sports
9ougmc	Jamie Benn and Miles Wood let the punches fly	sports
9ecaxm	[NRL] Loose Ball, Offload, Chip, Chase, Try!	sports
926z5p	A fan for life.	sports
9v12t9	Moeen Ali throws a ball from the deep & turns it into a helmet by the time it gets to the stumps!! (x-post r/cricket)	sports
9771ba	FIFA no longer considers "corruption" a violation under its new ethics code, but will now ban any officials found to have made "any public statements of a defamatory nature towards FIFA."	sports
9b9cx8	Small analysis of how McGregor bamboozled Alvarez	sports
9vf485	Exclusive: Tiger Woods turns down largest ever overseas pay cheque to play in Saudi Arabia	sports
9fzv2o	Quick throw goes wrong (NZ v South Africa)	sports
97scsi	Two more Olympic gymnasts reveal abuse by Larry Nassar	sports
96z9lr	Muhammad Ali finishes George Foreman in the 8th round to regain the Heavyweight title GIF	sports
8xsrg0	Mbappe Wasting Time Cheeky	sports
92lor7	In cricket, this is what you would call an unplayable ball.	sports
95ojvw	No-look shot at the World Badminton Championships	sports
9tauy7	Serena Williams is fined $17,000 for violations during her US Open loss	sports
9pj5cz	Rihanna turned down Super Bowl LIII halftime show because of Colin Kaepernick	sports
9lorti	Japanese log riding, known as Kiotoshi	sports
8udhwb	Mexican fans went to the Korean embassy and made the ambassador come out and drink tequila	sports
99n2y6	[Rugby League] Amazing scoop at speed to set up a try	sports
9ea107	Antoine Winfield Jr. game winning interception for Minnesota against Fresno State	sports
9tom9z	Midfield kick off goal in OT to win high school state championships	sports
9fauos	Naomi Osaka is reportedly set to sign Adidas' biggest deal with a female athlete — and it could make her one of the highest-paid women in sports	sports
9hy27v	If you thought the Browns losing streak was bad... today Hellgate HS (in Montana) ended a 57-game, 2,177-day losing streak	sports
9az2ig	Kevin Sanjaya changed racket to win a rally in Final Asian Games 2018	sports
907b0k	Today would’ve been legendary SportsCenter host Stuart Scott’s 53rd birthday. Cooler than the other side of the pillow, happy birthday Stuart.	sports
98cb0c	Goalkeeper pretends to be dead to avoid a Red (x-post r/soccer)	sports
93p71d	ESPN to bring back ‘The Ocho’ for day of dodgeball, chess boxing	sports
9uidgs	USOC to revoke USA Gymnastics’ status as national governing body of the sport	sports
92sme8	This second chance grab	sports
9e7e83	Kansas State has a 5'5" kicker and a 6'1" holder	sports
912nym	Just over three months after the bus crash that killed 16 hockey players in Saskatchewan, survivor Ryan Straschnitzki (left), who suffered a spinal injury, is practicing sledge hockey. He hopes to one day participate in the Paralympic Games.	sports
9s90ib	LA girl cheering after Boston homerun.	sports
9u83ue	Sports Droughts By City	sports
9k9xrz	Poland wins the volleyball World Championship after beating Brazil 3-0 in the final!	sports
9s6rtd	Lewis Hamilton wins his 5th World Drivers Championship, becoming the third person to achieve this after Juan Manuel Fangio and Michael Schumacher	sports
9m3myz	Conor McGregor has refused to press charges against his attackers at UFC 229	sports
8tgz9d	Senegal's training session looks fun.	sports
8ua2lg	NY Yankees Aaron Judge plays catch with a young fan in between innings.	sports
9o5pxq	Jadaveon Clowney tackles Chris Ivory by the hair	sports
95ugns	Crazy rally at World Badminton Championships	sports
90cvqd	Whatever it takes to get the out	sports
9lyemu	Oklahoma player did something to a Texas player I only saw done to cattle.	sports
8utlby	Mark Milligan from Australia sits on the grass and cries when being eliminated from World Cup. His daughters came to console him.	sports
9tc3a5	Carlos Beltran and his family dressed as different versions of Carlos Beltran on all the different teams he's played for	sports
9sfu4q	List of NCAA D-I Teams With The Most National Championships In A Single Sport has some interesting but not unexpected results, like skiing teams from Colorado and West Virginia's dominance in a unique sport.	sports
9hogag	[NRL] Billy Slater's try saving shoulder charge	sports
9nkmre	Jets and Predators exchanging punches	sports
9t5xjh	Derrick Rose caps off a 50 point game with the game winning block and is moved to tears as his teammates commend him for his performance.	sports
9tbf5h	Simone Biles makes history, proving American dominance by winning Worlds with two falls.	sports
8lpi40	They went right back to fighting after they both got out of the penalty box	sports
9mwzi6	Professional skiers training course	sports
9gcrin	Damontae Kazee Ejected For Late Helmet-To-Helmet Hit On Cam Newton	sports
9trja0	Ottawa REDBACKS Offensive Lineman Jon Gott celebrates a touchdown by chugging a beer	sports
9pf92w	Loving the equinox! Watching all of the big 4 professional leagues at the same time	sports
8vb6ck	Goalkeeper giving Russia the win over Spain in penalties. He blocked 2 kicks.	sports
9ulubo	Cliffs of Mohor breaking his shoulder during the Melbourne Cup, before being euthanized.	sports
9b9jme	Sexism row at the US Open: French tennis player Alizé Cornet penalized for changing shirt in front of the cameras	sports
9ot2bm	A sports equinox is when all 4 major sports play on the same day. With the Red Sox - Astros Series guaranteed to go 5 games, we’ll likely see 2 days this year with all 4 sports playing regular season or postseason games.	sports
8gheev	Skipping in a 380ft shot - Eagle McMahon	sports
8fnj3f	Jordan Mailata, a 6'8" 346 pound Samoan rugby league player who has never played football, got drafted in the 7th round by the Philadelphia Eagles	sports
8hfj96	Ichiro goes Full Ninja to score a run	sports
9k70o5	Europe wins Ryder Cup	sports
9amuvv	Team manager gets sent off from the field for tackling a player	sports
8mcq8j	Gareth Bale brilliant goal in Champion's League final	sports
9i88bw	Padel number 2 player, Paquito Navarro breaks glass during a play.	sports
8t9vbe	Lukaku shows that not all soccer players are floppers	sports
9ohexf	Paul Allen: Dead at 65	sports
9hsdc2	Dana White: McGregor signs new 6-fight deal with UFC	sports
9s4izw	The "sports equinox" is about to hit LA.	sports
9cbko2	Insane speed of modern F1 cars	sports
9k6cg7	Cooper Cronk (23) making a try Saving tackle on 6 foot 7in, 115kg Nelson Asofa-Solomona, in the NRL final. With a broken scapula	sports
8my68y	Surreal Shot of the Capital One Center during last night's Washington Capitals vs Las Vegas Knights Stanley Cup Finals Game	sports
8xqapq	Official Communication - Cristiano Ronaldo Officially moves to Juventus	sports
7xf1oq	Shaun White 97.75 gold metal run	sports
8rduoy	Cristiano Ronaldo scores a World Cup hat-trick to tie Portugal vs. Spain at 3-3	sports
8aj6ag	Rodney Mullen	sports
8j3u30	A young fan dressed as an umpire and called a Minor League game from the stands	sports
8y4ua8	During the Croatian celebration players fell over photographer Yuri Cortez, this is one of the pics	sports
9sjm8k	Klay Thompson breaks Curry's three-point record with 14 and scores 52 points in 3 quarters!	sports
90pu18	Murat Gassiev's explosive KO vs Jordan Shimmell	sports
8518cm	For the first time in NCAA tournament history a 16 seed has beat a 1 seed. UMBC (16) beats Virginia (1) 74 to 54	sports
8j9kht	Celtics fans after Game 1	sports
9dy5ge	Home field advantage, for all teams, in all four major league American sports	sports
9mr31f	[OC] Understanding the Pyramid: American Soccer Explained	sports
8eqwpi	Embiid celebrates with Kevin Hart. Then proceeds to pick him up like a little boy.	sports
9v3ae8	Little kid outplays Rodger Federer with a perfect lob shot	sports
92vcal	Hurling, one of the most popular sports in Ireland is on RTE 2 and Sky sports arena now. It has been described as; "The fastest game on grass", "A cross between sport and murder", "The best game you have never heard of". I just wanted to share my favourite sport with you guys	sports
8ze4ob	After 6 hours on a bus driving through the crowd, Croatian soccer players arrive at the main square. Almost 15% (550k) of the entire population greeted them today.	sports
9l6lgt	Jesperi Kotkaniemi of the Montreal Canadiens becomes the first athlete born in the 2000's to play in any of the Big 4 North American sports leagues	sports
9pecgh	Happy Sports Equinox day, everybody. 6 different North American sports have at least one event tonight.	sports
9uq7al	Shaq could literally dunk on the whole team at once	sports
83vkf4	Professional Tag Game at the World Chase Tag Championships	sports
9lmbhj	[Cricket] Incredible catch by Rachel Haynes (Australia vs New Zealand)	sports
7pfvwm	Red card anyone?	sports
8yszhx	First selfie of Manchester United's new Women's team !	sports
8dx59m	some superbly executed synchonised drop n' role.	sports
9mcm2t	Ronald Acuña Jr. becomes the youngest player to hit a postseason grand slam in baseball history	sports
841cfp	Lebron James pump fake and assist	sports
8codux	Spectator just past the halfway point of the Boston Marathon encouraging runners to not give up	sports
87icrb	Former New York Giants linebacker and Montana State star Corey Widmer has declined his nomination to the Montana Football Hall of Fame, saying the sport ''destroyed my life.''	sports
9s377y	Pittsburgh Steelers tribute to the victims of yesterday's synagogue shooting	sports
7x68xs	Chloe Kim land back-to-back 1080s for the first time in Olympic history to win Gold in the Women's Halfpipe with a 98.25	sports
9jgg54	Javier Báez tags out Puig and adds the Mutombo finger wag	sports
9twi5b	2018 Worlds Strongest Man "The Mountain" vs Arm-wrestling Champion Devon Larratt	sports
9jem9z	After 45 years and more than 1,000 fights, HBO is throwing in the towel on professional boxing	sports
9fewlv	The Humboldt Broncos played their first game tonight since the bus crash in April. Survivors Derek Patter and Brayden Camrud were joined by their teammates for the ceremonial faceoff.	sports
9dw1tp	NFL Corner Back Jalen Ramsey claims he could crack an NHL roster in 6 months	sports
9immsi	City of Seattle and Oak View Group announce a completely privately financed renovation of KeyArena creating a world class venue to host NHL hockey, Storm basketball, music, entertainment, and the eventual return of the Sonics	sports
9rdxen	"That" selfie	sports
9vmtac	Bowling pin defies gravity	sports
870h6x	[NRL] Chip, chase, flick pass, try!	sports
9ainl4	When it's your last shot to equalize the score but the crossbar hates you	sports
99rvos	ESPN's Michelle Beadle says she doesn't watch NFL or college football	sports
92680y	Gary Anderson throws a 9 Darter (perfect leg of Darts)	sports
8bmqeh	First ever Golden Knights playoff game in Las Vegas	sports
9sth6n	Boban Marjanovic of the LA Clippers came to wish actress and singer Kristin Chenoweth good luck with the national anthem before tonight's game	sports
8cz9fv	Gotta give it to the San Jose Sharks for this towel design. Amazing	sports
7zvjai	USA Men's Curling wins Olympic gold for first time ever.	sports
9vgszr	Football coaches agreed to slide in the mud if the team had a good practice	sports
9tohh5	Supermoto racer Arttu Stenberg showing off his skills	sports
9smey9	Back to back splits... on TV	sports
923owq	Reigning Tour de France champion Chris Froome was knocked off of his bike by a police officer after being mistaken for a spectator trying to ride the course. He was pissed to say the least.	sports
7wr3nv	Lightning Goaltender Andrei Vasilevskiy looks between his opponent's legs to locate puck and make behind the back glove save	sports
9k6b3y	Nasty stamp - Connacht v Leinster	sports
8vl0qz	Layun not having any of Neymar's theatrics.	sports
9ulki6	Marcus Mariota delays the handoff until the very last moment before flipping the ball forward for the touchdown	sports
9taifh	Derrick Rose reduced to tears after getting the game saving block and a 50 point game.	sports
8ukpwd	For the first time in World Cup history, a team has been eliminated based on yellow cards. Japan and Senegal finished on equal points, equal goal difference, equal goals scored, but Senegal were eliminated because they had more yellow cards (6) than Japan (4)	sports
8s3682	South London after Harry Kane's stoppage-time winner for England	sports
84ie4m	New York Ranger’s Pavel Buchnevich makes a kid with his old KHL jersey cry by giving him a stick and taking a picture with him	sports
9e19px	Kimbo Slice rag dolls his opponent	sports
9ojlye	LSU's Breiden Fehoko doing a traditional Haka war dance with his father and brother before the Georgia game this Saturday	sports
9eg4d6	Browns' Josh Gordon TD catch to tie the game against the Steelers	sports
99er4u	Ole Miss football player surprised with a scholarship at practice	sports
7zqme4	German foreign Office release wholesome travel advisory for Germans in Canada after amazing semi-final victory	sports
8596o8	March Madness summed up in one photo	sports
9loh6u	TIL that Jackie Robinson of baseball fame also played football. And he was damn good at it, too.	sports
8qntul	The Washington Capitals are having their Stanley Cup parade today but they also took out a full page ad in the Las Vegas Review-Journal to congratulate the Vegas Golden Knights "on the most successful inaugural season in the history of professional sports."	sports
7ymxzg	After four runs, Canada and Germany tie for gold in the men's two man bobsled. The teams tied to the hundredth of a second.	sports
9ppwhv	Muhammad Ali Dodges 21 Punches In 10 Seconds	sports
9r18k1	Shaun Murphy Trickshot vs Ronnie O'Sullivan	sports
8pkp6p	Backstrom finds Ovechkin across the ice over two Vegas sticks with a perfect pass	sports
7xz39n	Akwasi Frimpong, Ghana's First Skeleton Athlete, Enjoying PyeongChang	sports
8tq672	[Credit : @433] Senegal and Japan fans sing "We Are!" (Theme song from the Japanese anime, One Piece) after a 2-2 draw	sports
8h4izy	2 minutes for licking?	sports
874g7p	How the world curling final ended on NBCSN online	sports
87r554	Justice is done. Smith and Warner banned for 12 months, and Bancroft for 9	sports
952nl2	NASCAR CEO Brian France arrested for DUI, possession of controlled substance	sports
9nj4zk	Usain Bolt scores his first professional goal for the Central Coast Mariners	sports
9ozzcp	Celtics Fan from my school	sports
94mru3	The moment Jorginho’s mother saw his name on the back of a Chelsea shirt	sports
7pljhw	Why you shouldn’t use your cell phone during a basketball game	sports
9m2vhr	Khabib jumps into crowd to fight McGregors team after winning by submission.	sports
8sjdoe	The Beautiful Game	sports
9s8vej	Matt Damon and Jimmy Kimmel at the Boston Red Sox vs LA Dogders World Series game	sports
9od7un	The curve on that shot!	sports
8kvtiq	The Vegas Golden Knights have eliminated the Winnipeg Jets from the Stanley Cup Playoffs and advanced to the Stanley Cup Finals in their inaugural season	sports
91u2zu	Veterans Speak Out Against The Militarization Of Sports	sports
9qqm8r	Feeling a rookies's heartbeat before his debut	sports
81qhct	Washington Wizards Fans All Feel The Pain Simultaneously	sports
9t17hw	Happy Halloween from the RCR Pit Crew Department!	sports
9sgdbv	Los Angeles hosted a home game in five major sports Sunday. Two fans attended them all	sports
9qcg60	First Russian UFC champ during a ceromy honouring him	sports
9nobtn	Football coach runs through the locker room door during pregame speech	sports
9w1pp3	Chan Sung Jung (Korean Zombie) gets finished by Yair Rodriguez right at the buzzer [Unreal finish]	sports
8f3tcs	After three Tommy John surgeries and over 2000 days since his last MLB appearance, Jonny Ventures makes his Major League return and gets Chris Davis out in just four pitches	sports
812iyb	James Harden drops Wesley Johnson and hits the 3	sports
9thv8t	If such a summit occurred in today’s sports world for the purposes of social change, which athletes would be in the room?	sports
85dv11	Michigan State's Matt McQuaid turns his own blocked shot into a buzzer-beating three	sports
7t40pj	Football commentators are crazy!	sports
7s57e0	Best catch possibly in Cricket history	sports
96r68i	German athletes Fall at 4x100m relay	sports
96t9ae	Koepka wins PGA Championship, beating Tiger by 2 strokes	sports
8p9uf5	Colin Kaepernick's legal team expected to subpoena President Trump in case against NFL	sports
9optsg	TJ Dillashaw uses Renan Barão’s head as a punching bag successfully defending his Bantamweight championship.	sports
9mr3fb	One could say UofA security isn’t the best	sports
9fddq9	Triple save by Jannick Green	sports
8p13ur	Highest paid Athletes in 2018 - According to Forbes.	sports
9scy0o	Russell Westbrook offers to trade a young fan his shoe for a slice of pizza	sports
9vwhv1	Nebraska football celebrating the first snow of the year by making snow angels	sports
7z699d	[Ice Hockey] German announcers lose their minds as Germany beat Sweden in historic quarterfinal upset	sports
8r5i6p	Umpire giving out life lessons	sports
9v1373	Dez Bryant to the Saints	sports
7os6c3	The Buffalo Bills are back into the NFL playoffs after 17 years of not qualifying. Their fans are tailgating appropriately.	sports
8jn7qa	On this day, two years ago, Rougned Odor punched José Bautista and created my favorite photo in all of sports.	sports
7p0qol	Fan wearing a Gilbert jersey gets surprised by Rod Gilbert	sports
7nfchj	Bills fans waited in single digit temperatures to welcome the team home after making the playoffs for the first time since 1999.	sports
9e85so	You can see what it means to become an All Black in NZ	sports
9mb52a	BYU mascot just stole all your ladies	sports
8a6zcd	How the hell do you jump out of a pool.	sports
9q6n49	T.J. Lee requests a Wide Reciever then gets a train run on him	sports
9pgw2j	Kawhi Leonard is Able to Dunk and Palm the Ball Before It Hits the Floor	sports
8wnvt9	I’m sick of watching football when faking injuries is a legitimate tactic	sports
9h8hcd	Red Sox Fans Find "2018 AL East Champions" Banner, Bargaining with Team for its Return	sports
8jchx6	The Supreme Court has just ruled 7-2 to overturn the federal ban on sports gambling. It's a historic day in American sport.	sports
9vn5cf	Oliver Giroud scores an outrageous scorpion kick goal against Crystal Palace.	sports
9jnxvt	Steve-O, Now 10 Years Sober, Just Crushed His First Triathlon	sports
955kdu	The beautiful inswinger of Jimmy ‘The Burnley Express’ Anderson.	sports
7xhw8z	Norwegian curling team's Valentine's Day pants.	sports
8y398f	Iceland playing in the World Cup is equivalent to Staten Island, NY having a team and playing in the World Cup if you look at population.	sports
9jcj8b	This Day, 20 Years Ago: Mark McGwire hits #70. Phil Ozersky, a fan making $30K a year, catches the ball. The Cardinals ask him for the ball for a signed bat, ball & jersey. Ozersky says he also wants to meet McGwire. McGwire says no. 3 months later, Ozersky sells ball for $3.05M.	sports
8kjjua	USA jump rope league	sports
9hltmg	The Cleveland Browns have won their first game since December 24th, 2016	sports
7cyb0c	Foot sweep and knee	sports
7y73pf	Washington Capitals' Devante Smith-Pelly Squirting Water at an Annoying Heckler	sports
7svi1u	Thank You.	sports
9lcdi4	Why NASCAR pit crew wear firesuits	sports
7zgyc3	Tyler Nicholson and Staale Sandbech create a new Olympic Sport	sports
9o455r	Iowa State band brought out T-Rexes for the halftime show	sports
7quwx3	EHF Euro 2018 - Sigurdsson penalty rebound	sports
9uh9q6	Discrimination of Irish Catholics in British Sports.	sports
9qdwbd	Kareem Hunt breaks tackles and hurdles a defender	sports
873yqn	102 shot badminton rally	sports
7agbai	This is why the World Series was so big to Houston	sports
9mkxg8	Drew Brees passes Peyton Manning for most overall in passing yards in NFL history	sports
9a3c2z	Josef Martinez breaks the MLS record for most goals in a season	sports
9q24vo	Sugar Ray Robinson sets up possibly the greatest left hook ever thrown	sports
9myeqk	Zverev scares ball boy	sports
9s5q6i	Seahawks celebrate touchdown by charging the mound	sports
9qkxny	Damian Lillard of the Portland Trail Blazers entered the arena tonight as Stone Cold Steve Austin	sports
8w5o70	Did ESPN get rid of their comment section?	sports
9jyg5l	Pirates fan gives his foul ball to a little girl nearby	sports
8ujqye	"HAHAHAHAHAHA" read a tweet from FOX sports brazil which was 272 characters long after Germany's loss	sports
71yxee	LeBron James responds to Donald Trump rescinding Stephen Curry's invitation to the White House	sports
9rzk0t	Alex Ovechkin makes a young fan's day by giving him his stick	sports
96xo66	[Cricket] Brian Lara scores 153 not out, and singlehandedly wins the match for West Indies against Australia.	sports
89p9ng	A reminder of why the Masters is so great	sports
9inlgv	Vance MacDonald with one of my favorite stiff arms I’ve seen in a long time.	sports
9m25on	Dereck Lewis KO’s Alexander Volkov in UFC 229, proceeds to give the best speech in UFC history	sports
7gmjj1	A close call at 1st base	sports
8ti7r4	Panama's supporters celebrating goal effusively despite being 5 goals behind England.	sports
8yu7dm	Belgium beat England 2-0, finish third at the 2018 FIFA World Cup.	sports
8tww5o	How the MLS took penalties in the 90's	sports
8rjy3k	Icelandic player tries to get the ref a yellow card	sports
8tgaku	Lineker updated his famous line in response to Germany vs Sweden	sports
